<?xml version="1.0" encoding="UTF-8"?>
<pedido xmlns:xsi="http://www.w3.org/2001/XMLSchema-instance" 
  xsi:noNamespaceSchemaLocation="pedidos.xsd">

    <sucursales codPedido="P9852145">
        <direcciones>calle falsa 123</direcciones>
        <nombreTrabajador>Mariano Rajoy</nombreTrabajador>
        <fechaPedido>12-06-2020</fechaPedido>
        <observacionesPedido>urgente</observacionesPedido>
        <articulos codArticulo="ODN-597">
            <unidadesPedidas>3</unidadesPedidas>
            <precioUnidad>7</precioUnidad>
            <observacionesArt>fragil</observacionesArt>
            <revision>4</revision>
        </articulos>
    </sucursales>
</pedido>